{
  "schema_version": "0.3.0",
  "project_id": "NINEL",
  "project_format": "series",
  "season_premise": "Ninel awakens and questions Argo about her return.",
  "season_dramatic_question": "What does a return from failure mean?",
  "arc_strategy": "Two demonstration units split awakening from the answer; this is not an approved season outline.",
  "source_plotline_ids": [
    "NINEL-PL01"
  ],
  "source_event_ids": [
    "NINEL-EV001",
    "NINEL-EV002"
  ],
  "source_character_ids": [
    "NINEL-CH001",
    "NINEL-CH002"
  ],
  "episodes": [
    {
      "episode_id": "NINEL-E01",
      "episode_number": 1,
      "title": "Awakening",
      "episode_type": "premiere",
      "episode_premise": "Ninel chooses to breathe.",
      "cold_open": null,
      "act_outs": [
        {
          "position": "end",
          "turn": "Argo welcomes her back.",
          "pressure": "Her past remains unexplained."
        }
      ],
      "plot_distribution": [
        {
          "slot": "A",
          "plotline_id": "NINEL-PL01",
          "event_ids": [
            "NINEL-EV001"
          ],
          "episode_engine": "Ask what the awakening means.",
          "advancement": "A return is named."
        }
      ],
      "local_resolution": "She addresses the room.",
      "escalation": "The past remains uncertain.",
      "opening_hook": "Why must Ninel choose to breathe?",
      "forward_hook": {
        "target_episode_id": "NINEL-E02",
        "mechanism": "changed-goal",
        "promise": "Ninel asks where she has returned from."
      },
      "cliffhanger": null
    },
    {
      "episode_id": "NINEL-E02",
      "episode_number": 2,
      "title": "The answer",
      "episode_type": "finale",
      "episode_premise": "Ninel questions Argo.",
      "cold_open": null,
      "act_outs": [
        {
          "position": "end",
          "turn": "Argo names a failure.",
          "pressure": "Her past remains unexplained."
        }
      ],
      "plot_distribution": [
        {
          "slot": "A",
          "plotline_id": "NINEL-PL01",
          "event_ids": [
            "NINEL-EV002"
          ],
          "episode_engine": "Ask what the awakening means.",
          "advancement": "A failure is named."
        }
      ],
      "local_resolution": "Argo names a failure.",
      "escalation": "The past remains uncertain.",
      "opening_hook": "What does Argo know?",
      "forward_hook": null,
      "cliffhanger": null
    }
  ],
  "character_progression": [
    {
      "character_id": "NINEL-CH001",
      "episode_ids": [
        "NINEL-E01",
        "NINEL-E02"
      ],
      "event_ids": [
        "NINEL-EV001",
        "NINEL-EV002"
      ],
      "progression": "Ninel moves from voluntary breath to questioning.",
      "endpoint": "She has an incomplete explanation."
    }
  ],
  "relationship_progression": [
    {
      "character_ids": [
        "NINEL-CH001",
        "NINEL-CH002"
      ],
      "episode_ids": [
        "NINEL-E01",
        "NINEL-E02"
      ],
      "event_ids": [
        "NINEL-EV001",
        "NINEL-EV002"
      ],
      "progression": "Argo welcomes Ninel but withholds context.",
      "endpoint": "Trust remains uncertain."
    }
  ],
  "reveal_schedule": [
    {
      "event_id": "NINEL-EV002",
      "episode_id": "NINEL-E02",
      "reveal": "Argo says: From a failure.",
      "audience_effect": "The answer opens a question about the past."
    }
  ],
  "season_setups": [
    {
      "setup_event_id": "NINEL-EV001",
      "episode_id": "NINEL-E01",
      "setup": "Argo welcomes Ninel back.",
      "intended_payoff": "Ninel asks where she has returned from."
    }
  ],
  "finale_payoff": {
    "episode_id": "NINEL-E02",
    "setup_event_ids": [
      "NINEL-EV001"
    ],
    "payoff_event_ids": [
      "NINEL-EV002"
    ],
    "resolution": "Argo names a failure.",
    "consequence": "The past requires explanation.",
    "season_question_status": "partially-answered"
  },
  "unresolved_threads": [
    {
      "plotline_id": "NINEL-PL01",
      "state": "The failure remains undefined.",
      "reason_retained": "The supplied brief leaves this open."
    }
  ],
  "next_season_seeds": [],
  "assumptions": [
    "All serial development is a demonstration proposal."
  ],
  "uncertainties": []
}
